title,director_name,production_companies,actor_1_name,actor_2_name,actor_3_name,duration,genres,language,country,budget,revenue,year
moolaadé,Ousmane Sembene,Ciné-Sud Promotion Centre National de la Cinématographie (CNC) Fonds Sud Cinéma Centre Cinématographique Marocain (CCM) Cinétéléfilms Les Films Terre Africaine Ministère des Affaires étrangères et du Développement International Filmi Doomireew Direction de la Cinematographie Nationale,Fatoumata Coulibaly,Maimouna Hélène Diarra,Salimata Traoré,124.0,Drama,Bamanankan Français,Burkina Faso Cameroon France Morocco Senegal Tunisia,,214605.0,2004.0
this girl's life,Ash Baron-Cohen,Departure Entertainment Departure Studios TGL Inc.,James Woods,Juliette Marquis,Kip Pardue,104.0,Drama,English,United States of America,,,2004.0
memories of murder,Bong Joon-ho,Sidus Pictures CJ Entertainment Muhan Investment,Song Kang-ho,Kim Sang-kyung,Kim Roe-Ha,129.0,Crime Drama Thriller,한국어/조선말,South Korea,2800000.0,26000000.0,2003.0
the chase,Adam Rifkin,Twentieth Century Fox Film Corporation Capitol Films Hercules Films,Charlie Sheen,Kristy Swanson,Henry Rollins,89.0,Comedy Thriller Action Crime,English,United States of America,26000000.0,8009329.0,1994.0
hobson's choice,David Lean,London Film Productions British Lion Film Corporation,Charles Laughton,John Mills,Brenda De Banzie,107.0,Comedy Drama,English,United Kingdom,,,1954.0
dr. who and the daleks,Gordon Flemyng,AARU Productions,Peter Cushing,Roy Castle,Jennie Linden,82.0,Science Fiction Adventure,English,United Kingdom,502318.0,,1965.0
summer storm,Marco Kreuzpaintner,Claussen + Wöbke Filmproduktion GmbH,Robert Stadlober,Kostja Ullmann,Alicja Bachleda-Curuś,98.0,Comedy Drama,Deutsch,Germany,2700000.0,2085166.0,2004.0
downfall,Oliver Hirschbiegel,Degeto Film EOS Entertainment Rai Cinema Österreichischer Rundfunk (ORF) Constantin Film Produktion Westdeutscher Rundfunk (WDR) Norddeutscher Rundfunk (NDR),Bruno Ganz,Alexandra Maria Lara,Corinna Harfouch,156.0,Drama History War,Magyar Deutsch Pусский,Austria Germany Italy,18339750.0,92180910.0,2004.0
the white sound,Hans Weingartner,Cameo Film- und Fernsehproduktion Kunsthochschule für Medien Köln (KHM),Daniel Brühl,Patrick Joswig,Katharina Schüttler,107.0,Drama,Deutsch,Germany,250000.0,,2001.0
assault on precinct 13,Jean-François Richet,Rogue Pictures Why Not Productions Liaison Films Biscayne Pictures,Ethan Hawke,Laurence Fishburne,Gabriel Byrne,109.0,Thriller,English Srpski Español,United States of America France,30000000.0,35294470.0,2005.0
are we there yet?,Brian Levant,Columbia Pictures Revolution Studios Cube Vision,Ice Cube,Nia Long,Aleisha Allen,95.0,Adventure Comedy Family Romance,English,United States of America,32000000.0,97918663.0,2005.0
alone in the dark,Uwe Boll,Boll Kino Beteiligungs GmbH & Co. KG Brightlight Pictures Herold Productions Lionsgate Infogrames Entertainment,Christian Slater,Tara Reid,Stephen Dorff,96.0,Action Fantasy Horror Thriller,English Português,Canada Germany United States of America,20000000.0,10442808.0,2005.0
hide and seek,John Polson,Twentieth Century Fox Film Corporation Fox 2000 Pictures Josephson Entertainment MBC Beteiligungs Filmproduktion,Robert De Niro,Dakota Fanning,Famke Janssen,101.0,Horror Mystery Thriller,English,United States of America,25000000.0,122644820.0,2005.0
aliens of the deep,James Cameron Steven Quale,Walt Disney Pictures Walden Media,Anatoly M. Sagalevitch,Pamela Conrad,James Cameron,47.0,Action Documentary Science Fiction,English,United States of America,,,2005.0
boogeyman,Stephen T. Kay,Ghost House Pictures Senator International Screen Gems Pacific Renaissance Pictures Ltd.,Emily Deschanel,Barry Watson,Skye McCole Bartusiak,89.0,Thriller Horror Drama Mystery,English Français Polski,United States of America,20000000.0,67192859.0,2005.0
the wedding date,Clare Kilner,26 Films Gold Circle Films Visionview Production,Debra Messing,Dermot Mulroney,Amy Adams,88.0,Comedy Romance,English,United States of America,15000000.0,47175038.0,2005.0
inside i'm dancing,Damien O'Donnell,WT2 Productions,James McAvoy,Romola Garai,Steven Robertson,104.0,Drama,English,France Ireland United Kingdom,,,2004.0
nobody knows,Hirokazu Koreeda,Bandai Visual Company (JAPAN) Dare mo Shiranai Seisaku Iinkai Engine Films c-style,Yuya Yagira,Ayu Kitaura,Hiei Kimura,141.0,Drama,日本語,Japan,,,2004.0
employee of the month,Mitch Rouse,Yari Film Group,Matt Dillon,Steve Zahn,Christina Applegate,97.0,Action Comedy,English,United States of America,12000000.0,38528984.0,2004.0
magic in the water,Rick Stevenson,TriStar Pictures,Mark Harmon,Joshua Jackson,Harley Jane Kozak,98.0,Adventure Fantasy Drama Science Fiction Family,English,Canada United States of America,,,1995.0
the great white hope,Martin Ritt,"Lawrence Turman Films, Inc.",James Earl Jones,Jane Alexander,Lou Gilbert,103.0,Drama,English,United States of America,,,1970.0
a study in terror,James Hill,Compton Films,John Neville,Barbara Windsor,Judi Dench,95.0,Crime Drama Horror,English,United Kingdom,,,1965.0
everything about mustafa,Çağan Irmak,ANS Prodüksiyon,Nejat İşler,Fikret Kuskan,Başak Köklükaya,0.0,Drama Thriller,Turkish,Turkey,,261085.0,2004.0
the professionals,Richard Brooks,Columbia Pictures,Burt Lancaster,Lee Marvin,Robert Ryan,117.0,Action Adventure Western,English Español,United States of America,,,1966.0
the devil and miss jones,Sam Wood,Frank Ross-Norma Krasna Inc.,Jean Arthur,Charles Coburn,Robert Cummings,92.0,Comedy,English,United States of America,,,1941.0
alice in wonderland,Nick Willing,NBC Hallmark Entertainment Babelsberg International Film Produktion,Tina Majorino,Robbie Coltrane,Ben Kingsley,150.0,Fantasy Family,English,Germany United Kingdom United States of America,21000000.0,1025467110.0,1999.0
everyday people,Jim McKay,Alphaville Journeyman Pictures C-Hundred Film Corporation HBO Films,Jordan Gelber,Bridget Barkan,Stephen Henderson,0.0,Drama,English,United States of America,,,2004.0
backflash,Philip J. Jones,Paragon Film Group,Robert Patrick,Jennifer Esposito,Mike Starr,90.0,Crime Action,English,United States of America,,,2002.0
salem's lot,Tobe Hooper,Warner Bros. Television,David Soul,James Mason,Lance Kerwin,184.0,Mystery Horror Thriller,English,United States of America,4000000.0,,1979.0
the marriage of maria braun,Rainer Werner Fassbinder,Westdeutscher Rundfunk (WDR) Albatros Filmproduktion Trio Films Filmverlag der Autoren Fengler Films Tango Film,Hanna Schygulla,Klaus Löwitsch,Ivan Desny,116.0,War Drama,English Deutsch,Germany,,,1979.0
the bitter tears of petra von kant,Rainer Werner Fassbinder,Filmverlag der Autoren Tango Film,Margit Carstensen,Hanna Schygulla,Katrin Schaake,124.0,Drama,Deutsch,Germany,,,1972.0
beau geste,William A. Wellman,Paramount Pictures,Gary Cooper,Ray Milland,Robert Preston,112.0,Adventure Drama War,العربية English,United States of America,112.0,,1939.0
at sword's point,Lewis Allen,RKO Radio Pictures,Cornel Wilde,Maureen O'Hara,Gladys Cooper,81.0,Adventure,English,United States of America,,,1952.0
overnight,Mark Brian Smith Tony Montana,Ether Films Ronnoco Productions black & white pictures tony montana films,Troy Duffy,Billy Connolly,Norman Reedus,82.0,Documentary,English,United States of America,550.0,,2003.0
le trou,Jacques Becker,Filmsonor Titanus Play Art,Michel Constantin,Jean Keraudy,Philippe Leroy,132.0,Crime Drama Thriller,Français,France Italy,,33187.0,1960.0
lessons of darkness,Werner Herzog,Werner Herzog Filmproduktion Canal+ Première,Werner Herzog,unknown,unknown,54.0,War Documentary,العربية English Deutsch,United Kingdom Germany France,,,1992.0
fata morgana,Werner Herzog,Werner Herzog Filmproduktion,Wolfgang Bächler,Manfred Eigendorf,Lotte Eisner,79.0,Documentary Foreign,Deutsch,Germany,,,1971.0
double dragon,James Yukich,Gramercy Pictures,Robert Patrick,Mark Dacascos,Scott Wolf,89.0,Action Adventure Comedy Science Fiction,English Français,United States of America,3500000.0,2341309.0,1994.0
mac and me,Stewart Raffill,Orion Pictures,Jade Calegory,Lauren Stanley,Christine Ebersole,95.0,Family Fantasy Science Fiction,English,United States of America,,5935269.0,1988.0
scorchers,David Beaird,unknown,Faye Dunaway,Denholm Elliott,James Earl Jones,88.0,Comedy Drama Romance,English,unknown,,,1991.0
rosenstrasse,Margarethe von Trotta,Studio Hamburg Letterbox Filmproduktion Tele München Fernseh Produktionsgesellschaft (TMG),Katja Riemann,Maria Schrader,Doris Schade,136.0,Drama History,English Deutsch,Germany Netherlands,,,2003.0
casque d'or,Jacques Becker,Robert et Raymond Hakim,Simone Signoret,Serge Reggiani,Claude Dauphin,96.0,Crime Drama Romance,Français,France,,,1952.0
touchez pas au grisbi,Jacques Becker,Del Duca Films Antares Produzione Cinematografica,Jean Gabin,René Dary,Dora Doll,94.0,Action Crime Drama Thriller,Français,France Italy,,,1954.0
the matchmaker,Joseph Anthony,Don Hartman Productions,Anthony Perkins,Shirley MacLaine,Shirley Booth,103.0,Comedy Romance,English,United States of America,7000000.0,6000000.0,1958.0
the ballad of the sad cafe,Simon Callow,Channel Four Films Merchant Ivory Productions,Vanessa Redgrave,Keith Carradine,Cork Hubbert,101.0,Drama Romance Comedy Mystery,English,United Kingdom United States of America,,184890.0,1991.0
the deceivers,Nicholas Meyer,Michael White Productions Film Four International Merchant Ivory Productions Master Productions Cinecom Pictures,Pierce Brosnan,Shashi Kapoor,Saeed Jaffrey,102.0,Thriller Drama Action,English Deutsch,India United Kingdom,,346297.0,1988.0
siberia,Robert Jan Westdijk,Buffalo Gal Pictures Summerstorm Entertainment Company Films Lionsgate,Hugo Metsers,Vlatka Simac,Nicole Eggert,91.0,Drama Crime Romance Foreign,Nederlands English,Netherlands,2000000.0,2006704.0,1998.0
purple butterfly,Lou Ye,Shanghai Film Studios,Zhang Ziyi,Liu Ye,Feng Yuanzheng,127.0,War Drama History,Tiếng Việt 日本語 普通话,China,,,2003.0
easy,Jane Weinstock,Curb Entertainment Over Easy Productions,Marguerite Moreau,Brían F. O'Byrne,Naveen Andrews,99.0,Comedy Drama Romance,English,United States of America,,,2003.0
el cid,Anthony Mann,Samuel Bronston Productions Dear Film Produzione,Charlton Heston,Sophia Loren,Raf Vallone,182.0,Action Drama History Romance War,English Latin,Italy United States of America,6250000.0,,1961.0
going all the way,Mark Pellington,Lakeshore Entertainment Polygram Filmed Entertainment,Jeremy Davies,Ben Affleck,Amy Locane,110.0,Drama,English,United States of America,,86175.0,1997.0
a taxing woman,Juzo Itami,New Century Producers Itami Productions,Nobuko Miyamoto,Tsutomu Yamazaki,Masahiko Tsugawa,127.0,Comedy Crime,日本語,Japan,,,1987.0
the bunker,Rob Green,Millennium Pictures,Jason Flemyng,Andrew Tiernan,Christopher Fairbank,95.0,Action History Horror,English Deutsch,United States of America,,,2001.0
a fine madness,Irvin Kershner,Warner Bros. Pan Arts,Sean Connery,Joanne Woodward,Jean Seberg,107.0,Comedy Drama Romance,English,United States of America,,,1966.0
reap the wild wind,Cecil B. DeMille,Paramount Pictures,Ray Milland,John Wayne,Paulette Goddard,123.0,Adventure Drama,English,United States of America,,,1942.0
2009: lost memories,Si-myung Lee,Indecom Cinema,Jang Dong-gun,Toru Nakamura,Seo Jin-ho,136.0,Action Drama Foreign Science Fiction Thriller,日本語 한국어/조선말,South Korea,7000000.0,12049825.0,2002.0
the architecture of doom,Peter Cohen,SVT Drama Sandrews Svenska Filminstitutet (SFI) Poj Filmproduktion AB,Bruno Ganz,Bruno Ganz,Jeanne Moreau,119.0,Documentary,svenska,Sweden,,,1989.0
inferno,Roy Ward Baker,Twentieth Century Fox Film Corporation,Robert Ryan,Rhonda Fleming,William Lundigan,83.0,Romance Thriller Crime Drama,English,United States of America,1055000.0,220000000.0,1953.0
howl's moving castle,Hayao Miyazaki,Studio Ghibli Buena Vista Home Entertainment Mitsubishi d-rights Tohokushinsha Film Corporation,Takuya Kimura,Akihiro Miwa,Tatsuya Gashûin,119.0,Fantasy Animation Adventure,日本語,Japan,24000000.0,234710455.0,2004.0
steamboy,Katsuhiro Ōtomo,Bandai Visual Company Sunrise Studio 4°C,Anne Suzuki,Masane Tsukayama,Katsuo Nakamura,126.0,Animation Fantasy Science Fiction,English 日本語 Polski,Japan,20000000.0,18900000.0,2004.0
gorgeous,Vincent Kok,Golden Harvest Pictures,Jackie Chan,Shu Qi,Tony Leung Chiu-Wai,121.0,Adventure Action Comedy Romance,广州话 / 廣州話 普通话,Hong Kong,,,1999.0
the blade,Tsui Hark,Golden Harvest Company Film Workshop,Vincent Zhao,Xiong Xin-Xin,Song Lei,101.0,Drama Action,广州话 / 廣州話,Hong Kong,,,1995.0
assisted living,Elliot Greenebaum,unknown,Michael Bonsignore,Maggie Riley,Nancy Jo Boone,78.0,Comedy Drama,English,United States of America,500.0,41.0,2005.0
the nomi song,Andrew Horn,ARTE CV Films Cameo Filmproduktion Filmstiftung Nordrhein-Westfalen ZDF,David Bowie,Calvin Churchman,Klaus Nomi,98.0,Documentary Foreign,English Deutsch,Germany,,,2004.0
hitch,Andy Tennant,Columbia Pictures Corporation Overbrook Entertainment,Will Smith,Eva Mendes,Kevin James,118.0,Comedy Drama Romance,English,United States of America,70000000.0,368100420.0,2005.0
pooh's heffalump movie,Frank Nissen,Walt Disney Pictures,Jim Cummings,John Fiedler,Nikita Hopkins,68.0,Animation Family,English,United States of America,20000000.0,52900000.0,2005.0
inside deep throat,Fenton Bailey Randy Barbato,Imagine Entertainment Summit Entertainment HBO Documentary Films Universal Pictures,Dennis Hopper,Peter Bart,Warren Beatty,92.0,History Documentary,English,United States of America,2000000.0,653621.0,2005.0
uncle nino,Robert Shallcross,unknown,Joe Mantegna,Anne Archer,Pierrino Mascarino,104.0,Comedy Drama Family,English,United States of America,,,2003.0
bride & prejudice,Gurinder Chadha,Bend It Films Kintop Pictures UK Film Council Inside Track Films Pathé MEDIA Programme of the European Union India Take One,Aishwarya Rai Bachchan,Martin Henderson,Naveen Andrews,111.0,Drama Comedy Music Romance,English हिन्दी Magyar Italiano ਪੰਜਾਬੀ Español,United Kingdom United States of America,7000000.0,24700000.0,2004.0
constantine,Francis Lawrence,Village Roadshow Pictures DC Comics Lonely Film Productions GmbH & Co. KG. Donners' Company Branded Entertainment/Batfilm Productions Weed Road Pictures 3 Art Entertainment Di Bonaventura Pictures Warner Bros.,Keanu Reeves,Rachel Weisz,Shia LaBeouf,121.0,Drama Fantasy Horror,English Português ,Germany United States of America,100000000.0,230884728.0,2005.0
son of the mask,Lawrence Guterman,New Line Cinema Pathé Distribution,Jamie Kennedy,Alan Cumming,Traylor Howard,94.0,Fantasy Comedy Family Adventure,English,Germany United States of America,84000000.0,,2005.0
because of winn-dixie,Wayne Wang,Twentieth Century Fox Film Corporation,Jeff Daniels,AnnaSophia Robb,Cicely Tyson,106.0,Comedy Drama Family,English,United States of America,14000000.0,32645546.0,2005.0
turtles can fly,Bahman Ghobadi,Bac Films Mij Film Co.,Soran Ebrahim,Avaz Latif,Saddam Hossein Feysal,98.0,Drama,ku,Iran France Iraq,,,2005.0
beautiful boxer,Ekachai Uekrongtham,GMM Pictures Co.,Asanee Suwan,Sorapong Chatree,Orn-anong Panyawong,117.0,Drama,English 日本語 ภาษาไทย,Thailand,,638317.0,2004.0
pauly shore is dead,Pauly Shore,Landing Patch Productions,Sean Penn,Charlie Sheen,Whoopi Goldberg,82.0,Comedy,English,United States of America,,,2003.0
bunny lake is missing,Otto Preminger,Wheel Productions,Laurence Olivier,Carol Lynley,Keir Dullea,107.0,Thriller Mystery,English,United Kingdom,,,1965.0
jeremy,Arthur Barron,Kennesset Productions,Robby Benson,Glynnis O'Connor,Leonardo Cimino,84.0,Drama Family Romance,English,United States of America,,,1973.0
don't tell her it's me,Malcolm Mowbray,Hemdale Film Corporation Metro-Goldwyn-Mayer Braunstein and Hamady Productions,Steve Guttenberg,Jami Gertz,Shelley Long,101.0,Comedy Romance,English,United States of America,6700000.0,,1990.0
until september,Richard Marquand,United Artists,Karen Allen,Thierry Lhermitte,Christopher Cazenove,95.0,Drama Romance,English,United States of America,,4100000.0,1984.0
night and the city,Jules Dassin,Twentieth Century Fox Film Corporation,Richard Widmark,Gene Tierney,Googie Withers,101.0,Drama Thriller,English,United Kingdom,,,1950.0
frozen land,Aku Louhimies,Yleisradio (YLE) Solar Films inc.,Jasper Pääkkönen,Mikko Leppilampi,Pamela Tola,127.0,Drama,suomi,Finland,2000000.0,,2005.0
big girls don't cry,Maria von Heland,unknown,Anna Maria Mühe,Karoline Herfurth,David Winter,87.0,Drama,Deutsch,Germany,,,2002.0
white banners,Edmund Goulding,unknown,Claude Rains,Fay Bainter,Jackie Cooper,92.0,Drama,English,unknown,,,1938.0
night watch,Timur Bekmambetov,Bazelevs Production Channel One Russia TABBAK The First Channel,Konstantin Khabenskiy,Vladimir Menshov,Galina Tyunina,114.0,Fantasy Action Thriller,Deutsch Pусский,Russia,4200000.0,32000000.0,2004.0
dot the i,Matthew Parkhill,Alquimia Cinema Arcane Pictures,Gael García Bernal,Natalia Verbeke,James D'Arcy,92.0,Comedy Drama Romance Thriller,English Español,Spain United Kingdom United States of America,,,2003.0
bright leaves,Ross McElwee,First Run Features,Ross McElwee,Brian Baucom,Susan Bennett,107.0,Documentary,English,United States of America,,,2004.0
topper returns,Roy Del Ruth,Hal Roach Studios,Joan Blondell,Roland Young,Carole Landis,88.0,Comedy Fantasy Mystery Romance,English,United States of America,,,1941.0
sons of the desert,William A. Seiter,Hal Roach Studios,Stan Laurel,Oliver Hardy,Charley Chase,68.0,Action Comedy,English,United States of America,,,1933.0
morocco,Josef von Sternberg,Paramount Pictures,Gary Cooper,Marlene Dietrich,Adolphe Menjou,92.0,Drama Romance,العربية English Français Italiano Español,United States of America,,,1930.0
surplus: terrorized into being consumers,Erik Gandini,Atmo Media Network,John Zerzan,George W. Bush,Fidel Castro,54.0,Documentary,English Español svenska,Sweden,,,2003.0
man of the house,Stephen Herek,Revolution Studios Bel Air Entertainment,Tommy Lee Jones,Cedric the Entertainer,Christina Milian,100.0,Comedy Action,English,United States of America,40000000.0,21577624.0,2005.0
samson and delilah,Cecil B. DeMille,Paramount Pictures,Hedy Lamarr,Victor Mature,Angela Lansbury,128.0,Drama Romance,English,United States of America,3000000.0,11500000.0,1949.0
kung fu hustle,Stephen Chow,Columbia Pictures,Stephen Chow,Yuen Wah,Yuen Qiu,99.0,Action Comedy Crime Fantasy,广州话 / 廣州話,China Hong Kong,20000000.0,100914445.0,2004.0
shark skin man and peach hip girl,Katsuhito Ishii,Tohokushinsha Film,Tadanobu Asano,Ittoku Kishibe,Sie Kohinata,108.0,Comedy Action Thriller Mystery,日本語,Japan,,,1998.0
the five people you meet in heaven,Lloyd Kramer,unknown,Jon Voight,Ellen Burstyn,Jeff Daniels,180.0,Drama Fantasy Science Fiction,English,United States of America,20000000.0,,2004.0
"no retreat, no surrender",Corey Yuen Kwai,New World Pictures,Kurt McKinney,Jean-Claude Van Damme,J.W. Fails,85.0,Action,English,Hong Kong United States of America,,4662137.0,1986.0
the chubbchubbs!,Eric Armstrong,Sony Picture Imageworks,Bradford Simonsen,Jeff Wolverton,Dustin Adair,5.0,Animation Comedy Science Fiction,English,United States of America,,,2002.0
travellers and magicians,Khyentse Norbu,Prayer Flag Pictures,Tshewang Dendup,Sonam Lhamo,Lhakpa Dorji,108.0,Adventure Drama Foreign,dz,Bhutan United Kingdom Australia,,,2003.0
želary,Ondřej Trojan,Dor Film Produktionsgesellschaft GmbH Ceská Televize Österreichischer Rundfunk (ORF) Barrandov Studios Total HelpArt T.H.A. ALEF Film & Media Group,Anna Geislerová,Cserhalmi György,Jaroslava Adamová,150.0,Drama Romance,Český Deutsch Pусский,Austria Czech Republic Slovakia,,,2003.0
dragonworld,Ted Nicolaou,Paramount Pictures Full Moon Entertainment Moonbeam Entertainment,Courtland Mead,Janet Henfrey,Andrew Keir,86.0,Adventure Fantasy,English,United States of America,,,1994.0
dr. giggles,Manny Coto,Universal Pictures Dark Horse Entertainment Largo Entertainment JVC Entertainment Networks,Larry Drake,Holly Marie Combs,Cliff DeYoung,95.0,Comedy Horror Mystery Thriller,English,Japan United States of America,,8403433.0,1992.0
the corn is green,Irving Rapper,Warner Bros.,Bette Davis,Nigel Bruce,Rhys Williams,115.0,Drama,English Cymraeg,United States of America,,,1945.0
the seven-per-cent solution,Herbert Ross,Universal Pictures Herbert Ross Productions,Alan Arkin,Vanessa Redgrave,Robert Duvall,113.0,Thriller Mystery,English,United Kingdom United States of America,5000000.0,,1976.0
the three musketeers,Richard Lester,Film Trust S.A. Alexander Salkind,Michael York,Oliver Reed,Richard Chamberlain,105.0,Action Adventure Comedy Drama,English,United States of America,75000000.0,132274484.0,1973.0
royal flash,Richard Lester,Twentieth Century Fox Film Corporation,Malcolm McDowell,Alan Bates,Florinda Bolkan,102.0,Adventure Comedy Romance,English,United Kingdom United States of America,,,1975.0
masculin féminin,Jean-Luc Godard,Sandrews Argos Films Svensk Filmindustri (SF) Anouchka Films,Jean-Pierre Léaud,Chantal Goya,Marlène Jobert,110.0,Drama Romance,English Français svenska,Sweden France,,,1966.0
fallen angel,Otto Preminger,Twentieth Century Fox Film Corporation,Alice Faye,Dana Andrews,Linda Darnell,98.0,Crime Mystery Romance,English,United States of America,,,1945.0
the four feathers,Zoltan Korda,London Film Productions,John Laurie,John Clements,Ralph Richardson,129.0,War Adventure Drama Romance,English,United Kingdom,,,1939.0
the phone box,Antonio Mercero,Televisión Española (TVE),José Luis López Vázquez,Agustín González,Goyo Lebrero,35.0,Horror Thriller Drama,Español,Spain,,,1972.0
night of the demon,Jacques Tourneur,Sabre Film Productions Ltd.,Dana Andrews,Peggy Cummins,Niall MacGinnis,95.0,Horror Mystery,English,United Kingdom United States of America,,,1957.0
control,Nimród Antal,Café Film Bonfire,Sándor Csányi,Csaba Pindroch,Mucsi Zoltán,105.0,Comedy Crime Thriller,Magyar Italiano Español,Hungary,500000.0,,2003.0
beautiful city,Asghar Farhadi,Neshane,Taraneh Alidoosti,Babak Ansari,Faramarz Gharibian,101.0,Drama,فارسی,Iran,,,2005.0
five times two,François Ozon,Fidélité Productions France 2 Cinéma FOZ,Valeria Bruni Tedeschi,Stéphane Freiss,Géraldine Pailhas,90.0,Drama Romance,Italiano Français English,France,,,2004.0
tart,Christina Wayne,Interlight Green Moon Productions,Dominique Swain,Brad Renfro,Bijou Phillips,94.0,Comedy Drama Romance,English,Canada United States of America,3300000.0,,2001.0
bed and board,François Truffaut,Valoria Films Fida cinematografica,Jean-Pierre Léaud,Claude Jade,Daniel Ceccaldi,100.0,Comedy Drama Romance,Français,France,,,1970.0
germany year zero,Roberto Rossellini,Produzione Salvo D'Angelo Tevere Film,Edmund Moeschke,Ernst Pittschau,Ingetraud Hinze,70.0,War Drama,English Deutsch Italiano,Italy,,,1948.0
tombs of the blind dead,Amando de Ossorio,Plata Films S.A. Interfilme,Lone Fleming,César Burner,María Elena Arpón,101.0,Horror,Español,Portugal Spain,,,1972.0
the sicilian clan,Henri Verneuil,Les Productions Fox Europa Les Films du Siècle,Jean Gabin,Alain Delon,Lino Ventura,125.0,Crime,English Français Italiano,France,19000000.0,,1969.0
love me tonight,Rouben Mamoulian,Paramount Pictures,Maurice Chevalier,Jeanette MacDonald,Charles Ruggles,104.0,Comedy Music Romance,English,United States of America,,,1932.0
a hole in my heart,Lukas Moodysson,"Zentropa Entertainments Nordisk Film Memfis Film Film i Väst Svenska Filminstitutet (SFI) SVT Drama, Göteborg",Thorsten Flinck,Björn Almroth,Sanna Bråding,98.0,Drama,svenska,Denmark Sweden,,,2004.0
bigger than the sky,Al Corley,Code Entertainment Coquette Productions Neverland Films,Amy Smart,Sean Astin,John Corbett,106.0,Comedy Romance,English,United States of America,750000.0,20149.0,2005.0
diary of a mad black woman,Darren Grant,Lions Gate Films,Kimberly Elise,Steve Harris,Tyler Perry,116.0,Comedy Drama Romance,English,United States of America,5500000.0,50652203.0,2005.0
cursed,Wes Craven,Craven-Maddalena Films Outerbanks Entertainment Dimension Films Kalis Productions GmbH & Co. Zweite KG,Portia de Rossi,Christina Ricci,Jesse Eisenberg,97.0,Horror Comedy,English,Germany United States of America,35000000.0,19294901.0,2005.0
up and down,Jan Hřebejk,unknown,Petr Forman,Jan Tříska,Emília Vášáryová,108.0,Comedy Drama Foreign,Český,Czech Republic,2000000.0,,2004.0
gory gory hallelujah,Sue Corcoran,unknown,Angie Louise,unknown,unknown,0.0,Horror,English,unknown,,,2003.0
the pacifier,Adam Shankman,Walt Disney Pictures Spyglass Entertainment,Vin Diesel,Lauren Graham,Faith Ford,95.0,Action Comedy Drama Family Thriller,English 한국어/조선말,Canada United States of America,56000000.0,113006880.0,2005.0
be cool,F. Gary Gray,Double Feature Films Jersey Films Nina Saxon Film Design Metro-Goldwyn-Mayer (MGM),John Travolta,Uma Thurman,Vince Vaughn,118.0,Comedy Crime,English Pусский,United States of America,53000000.0,95226116.0,2005.0
gunner palace,Petra Epperlein Michael Tucker,Nomados Film,Bryant Davis,Devon Dixon,Javorn Drummond,85.0,Documentary History War,English,United States of America,,,2004.0
walk on water,Eytan Fox,Lama Films United King Films,Lior Ashkenazi,Knut Berger,Caroline Peters,103.0,Drama,العربية English Deutsch עִבְרִית Italiano Türkçe,Israel Sweden,1400000.0,444.0,2004.0
hostage,Florent-Emilio Siri,Miramax Films Cheyenne Enterprises Yari Film Group Stratus Film Co. Syndicate Films International Equity Pictures Medienfonds GmbH & Co. KG II Hostage GmbH,Bruce Willis,Kevin Pollak,Jimmy Bennett,113.0,Mystery Drama Thriller Crime,English,Germany United States of America,52000000.0,77944725.0,2005.0
robots,Chris Wedge Carlos Saldanha,Blue Sky Studios Twentieth Century Fox Animation,Robin Williams,Ewan McGregor,Halle Berry,91.0,Animation Comedy Family Science Fiction,English Italiano,United States of America,75000000.0,260696994.0,2005.0
