title,director_name,production_companies,actor_1_name,actor_2_name,actor_3_name,duration,genres,language,country,budget,revenue,year
ivanhoe,Douglas Camfield,Columbia Pictures Television Rosemont Productions,Anthony Andrews,James Mason,Sam Neill,137.0,Drama History Adventure,English,United Kingdom,3842000.0,10878000.0,1982.0
ronja robbersdaughter,Tage Danielsson,AB Svenska Ord AB Film-Teknik Sveriges Television (SVT) Svensk Filmindustri (SF) Norsk Film,Hanna Zetterberg,Dan Håfström,Börje Ahlstedt,126.0,Adventure Drama Fantasy Family,svenska,Sweden Norway,,,1984.0
framed,Jonas Frick,Svensk Filmindustri (SF),Björn Skifs,Gino Samil,Johan Ulveson,101.0,Action Comedy,svenska,Sweden,,5839164.0,1988.0
breaking out,Daniel Lind Lagerlöf,Sonet Film AB,Björn Kjellman,Peter Haber,Viveka Seldahl,105.0,Comedy Drama,svenska,Sweden,,,1999.0
yrrol,Peter Dalle,Svenska Filminstitutet Cinema Art Dalle Manus & Regi Deadline TV 1000,Suzanne Reuter,Ulla Skoog,Peter Dalle,88.0,Comedy,svenska,Sweden,,,1994.0
the wind that shakes the barley,Ken Loach,BIM Distribuzione Matador Pictures Diaphana Films Bórd Scannán na hÉireann Element Films UK Film Council Pathé Distribution Irish Film Board Tornasol Films Sixteen Films Regent Capital EMC Produktion Cinéart TV3 Television Network Ireland Filmcoopi Zürich Oil Flick Films No.2,Cillian Murphy,Pádraic Delaney,Liam Cunningham,124.0,Drama History War,English Gaeilge Latin,Ireland United Kingdom Germany Italy Spain France Belgium Switzerland,6500000.0,22889018.0,2006.0
blood on the moon,Robert Wise,RKO Radio Pictures,Robert Mitchum,Barbara Bel Geddes,Robert Preston,88.0,Action Western Drama,English,United States of America,,88.0,1948.0
le notti bianche,Luchino Visconti,Vides Cinematografica Cinematografica Associati (CI.AS.) Rank Film,Maria Schell,Marcello Mastroianni,Jean Marais,101.0,Drama Romance,Italiano,Italy France,,,1957.0
fateless,Lajos Koltai,unknown,Marcell Nagy,Béla Dóra,Bálint Péntek,140.0,War Drama,English Deutsch עִבְרִית Magyar Polski ,Hungary Germany United Kingdom Israel,,,2005.0
the bravados,Henry King,Twentieth Century Fox Film Corporation,Gregory Peck,Joan Collins,Henry Silva,98.0,Drama Action Western,English,United States of America,,,1958.0
the sign of the cross,Cecil B. DeMille,Paramount Pictures,Fredric March,Elissa Landi,Claudette Colbert,124.0,Drama History,English,United States of America,,,1932.0
the criminal life of archibaldo de la cruz,Luis Buñuel,Alianza Cinematográfica Española,Ernesto Alonso,Miroslava,Rita Macedo,89.0,Comedy Crime Drama,Español,Mexico,,,1955.0
overlord,Stuart Cooper,Joswend,Brian Stirner,Davyd Harries,Nicholas Ball,83.0,War Drama History,English,United Kingdom,38000000.0,41657844.0,1975.0
severance,Christopher Smith,Qwerty Films Dan Films Isle of Man Film HanWay Films UK Film Council N1 European Film Produktions GmbH & Co. KG,Danny Dyer,Laura Harris,Toby Stephens,96.0,Horror Comedy Thriller,English Magyar Pусский,United Kingdom Germany Hungary,,5515163.0,2006.0
time to leave,François Ozon,Canal Plus Fidélité Productions,Melvil Poupaud,Jeanne Moreau,Valeria Bruni Tedeschi,85.0,Drama,Deutsch Français English,France,,,2005.0
hollywoodland,Allen Coulter,Focus Features,Adrien Brody,Diane Lane,Ben Affleck,126.0,Drama Thriller Crime,English,United States of America,,16803753.0,2006.0
the covenant,Renny Harlin,"Screen Gems, Inc.",Steven Strait,Laura Ramsey,Jessica Lucas,97.0,Action Adventure Fantasy Horror Science Fiction Thriller,English,United States of America,20000000.0,37597471.0,2006.0
jesse james,Henry King,Twentieth Century Fox Film Corporation,Tyrone Power,Henry Fonda,Nancy Kelly,106.0,Western Crime Drama History,English,United States of America,1600000.0,,1939.0
the scar,Jimmy Larouche,Cicatrice Film inc,Marc Béland,Patrick Goyette,Sébastien Leblanc,90.0,Drama,Français,Canada,,,2013.0
the last kiss,Tony Goldwyn,Lakeshore Entertainment Mel's Cite du Cinema,Zach Braff,Jacinda Barrett,Casey Affleck,115.0,Comedy Drama Romance,English,United States of America,20000000.0,,2006.0
gabrielle,Patrice Chéreau,Azor Film,Isabelle Huppert,Pascal Greggory,Claudia Coli,90.0,Action Comedy Drama Foreign Romance Thriller,Français,Germany France Italy,,,2005.0
trust the man,Bart Freundlich,Trust the Man LLC,David Duchovny,Julianne Moore,Billy Crudup,103.0,Comedy Drama Romance,English,United States of America,9000000.0,,2005.0
sherrybaby,Laurie Collyer,Red Envelope Entertainment,Maggie Gyllenhaal,Michelle Hurst,Sandra Rodríguez,96.0,Drama,English,United States of America,2000000.0,622806.0,2006.0
bio zombie,Wilson Yip,"Cameron Entertainment Co., Ltd. Brilliant Idea Group",Jordan Chan,Emotion Cheung,Sam Lee,94.0,Horror Comedy Foreign,广州话 / 廣州話,Hong Kong,,791702.0,1998.0
idiocracy,Mike Judge,Twentieth Century Fox Film Corporation Ternion Pictures,Luke Wilson,Maya Rudolph,Dax Shepard,84.0,Adventure Comedy Science Fiction,English,United States of America,30000000.0,495303.0,2006.0
jesus camp,Heidi Ewing Rachel Grady,Loki Films A&E IndieFilms,Becky Fischer,Mike Papantonio,Ted Haggard,87.0,Documentary,English,United States of America,,1013596.0,2006.0
the bow,Kim Ki-duk,Kim Ki-Duk Film Happinet Pictures,Seo Ji-Seok,Jeon Kuk-hwan,Seong-hwang Jeon,89.0,Drama Romance,한국어/조선말,South Korea Japan,10.0,,2005.0
the crusades,Cecil B. DeMille,Paramount Pictures,Loretta Young,Henry Wilcoxon,Ian Keith,125.0,Adventure Drama History,English,United States of America,,,1935.0
the tiger and the snow,Roberto Benigni,Melampo Cinematografica,Roberto Benigni,Nicoletta Braschi,Tom Waits,114.0,Comedy Drama Romance,العربية English Italiano,Italy,35000000.0,,2005.0
pretty poison,Noel Black,Twentieth Century Fox Film Corporation,Anthony Perkins,Tuesday Weld,Beverly Garland,89.0,Crime Drama Romance Thriller,English,United States of America,1800000.0,,1968.0
the fountain,Darren Aronofsky,Regency Enterprises Warner Bros. Muse Entertainment Enterprises Protozoa Pictures New Regency Pictures,Hugh Jackman,Rachel Weisz,Ellen Burstyn,96.0,Drama Adventure Science Fiction Romance,English,United States of America,35000000.0,15304890.0,2006.0
fear city: a family-style comedy,Alain Berbérian,Le Studio Canal+ Téléma Productions M6 Films France 3 Cinema,Chantal Lauby,Alain Chabat,Dominique Farrugia,93.0,Comedy,Français,France,,,1994.0
assassin(s),Mathieu Kassovitz,TF1 Films Production Zweites Deutsches Fernsehen (ZDF) Canal+ Les Productions Lazennec La Sept Cinéma Kasso Inc. Productions,Michel Serrault,Mathieu Kassovitz,Mehdi Benoufa,128.0,Drama Crime,Français,Germany France,,,1997.0
union pacific,Cecil B. DeMille,Paramount Pictures,Barbara Stanwyck,Joel McCrea,Akim Tamiroff,135.0,Drama Western,English,United States of America,,,1939.0
a boy named charlie brown,Bill Melendez,Cinema Center Films Lee Mendelson Film Productions Bill Melendez Productions United Feature Syndicate (UFS),Peter Robbins,Pamelyn Ferdin,Glenn Gilger,86.0,Animation Comedy Family,English Magyar Italiano,United States of America,,,1969.0
"snoopy, come home",Bill Melendez,Cinema Center Films,Chad Webber,Robin Kohn,Stephen Shea,81.0,Family,English,United States of America,,,1972.0
a soldier's sweetheart,Thomas Michael Donnelly,unknown,Kiefer Sutherland,Skeet Ulrich,Georgina Cates,112.0,TV Movie War Drama,English,unknown,,,1998.0
the science of sleep,Michel Gondry,Gaumont France 3 Cinéma Canal+ TPS Star Partizan Films Mikado Film,Gael García Bernal,Charlotte Gainsbourg,Miou-Miou,105.0,Comedy Drama Fantasy,English Français Español,France Italy,6000000.0,9524340.0,2006.0
city for conquest,Jean Negulesco Anatole Litvak,Warner Bros.,James Cagney,Ann Sheridan,Frank Craven,104.0,Music Drama Crime,English,United States of America,,,1940.0
initial d,Andrew Lau Alan Mak,Media Asia Film Sil-Metropole Organisation Avex Inc. Basic Pictures,Jay Chou,Jordan Chan,Shawn Yue,107.0,Action Crime Thriller Drama,English 广州话 / 廣州話,Hong Kong China,1549000.0,7096000.0,2005.0
wicked,Michael Steinberg,Frankestein Entertainment Flipped Out Productions,Julia Stiles,William R. Moses,Patrick Muldoon,88.0,Thriller,English,United States of America,4000000.0,,1998.0
the long voyage home,John Ford,United Artists Argosy Pictures Walter Wanger Productions,John Wayne,Thomas Mitchell,Ian Hunter,105.0,Action Drama War,English,United States of America,,,1940.0
not as a stranger,Stanley Kramer,United Artists Stanley Kramer Productions,Olivia de Havilland,Robert Mitchum,Frank Sinatra,135.0,Drama Romance,English,United States of America,,,1955.0
the black dahlia,Brian De Palma,Universal Pictures Davis-Films Signature Pictures Linson Entertainment Art Linson Productions Millennium Films Equity Pictures Medienfonds GmbH & Co. KG III Nu Image Entertainment GmbH,Josh Hartnett,Scarlett Johansson,Aaron Eckhart,121.0,Drama,English,France Germany United States of America,50000000.0,49111202.0,2006.0
the woods,Lucky McKee,United Artists Furst Films SLS Video Productions Cinerenta Feature Films Cinegreen,Agnes Bruckner,Patricia Clarkson,Rachel Nichols,91.0,Mystery Horror Thriller,English,United Kingdom United States of America,,,2006.0
everyone's hero,Christopher Reeve Colin Brady Dan St. Pierre,Twentieth Century Fox Film Corporation Starz Animation IDT Entertainment,William H. Macy,Rob Reiner,Brian Dennehy,88.0,Action Adventure Animation Comedy Drama Family,Český Dansk English,Canada United States of America,35000000.0,16627188.0,2006.0
gridiron gang,Phil Joanou,Columbia Pictures,Dwayne Johnson,Xzibit,L. Scott Caldwell,125.0,Action Adventure Crime Drama,English,United States of America,30000000.0,41480851.0,2006.0
the seventh continent,Michael Haneke,Wega Film,Birgit Doll,Dieter Berner,Leni Tanzer,107.0,Drama,Deutsch,Austria,,,1989.0
aaltra,Benoît Delépine Gustave de Kervern,La Parti Productions,Benoît Delépine,Gustave de Kervern,Michel de Gavre,92.0,Comedy Foreign Drama,English suomi Français Deutsch,France,,,2004.0
wonder man,H. Bruce Humberstone,"Samuel Goldwyn Company, The",Danny Kaye,Virginia Mayo,Vera-Ellen,98.0,Music Comedy Fantasy,English,United States of America,,,1945.0
lisbon story,Wim Wenders,Road Movies Filmproduktion Madragoa Filmes Wim Wenders Stiftung,Rüdiger Vogler,Patrick Bauchau,Vasco Sequeira,100.0,Drama Foreign Thriller,English Deutsch Português,Germany Portugal,,,1994.0
streamers,Robert Altman,Streamers International,Matthew Modine,Michael Wright,Mitchell Lichtenstein,118.0,Drama,English,United States of America,,,1983.0
land of plenty,Wim Wenders,Emotion Pictures Reverse Angle International InDigEnt (Independent Digital Entertainment),Michelle Williams,John Diehl,Shaun Toub,123.0,Drama History War,English,Canada United States of America Germany,,,2004.0
lemming,Dominik Moll,Diaphana Films,Charlotte Gainsbourg,Charlotte Rampling,André Dussollier,130.0,Drama Thriller Mystery,Français,France,,793604.0,2005.0
taxidermia,György Pálfi,Amour Fou Filmproduktion Eurofilm Stúdió La Cinéfacture,Molnár Piroska,Mária Bodor,Albert Oláh,91.0,Drama Horror Comedy,English Magyar Pусский,Austria France Hungary,,,2006.0
flight from death: the quest for immortality,Patrick Shen,unknown,Sam Keen,Gabriel Byrne,unknown,0.0,Documentary,English,unknown,,,2003.0
yuva,Mani Ratnam,Madras Talkies,Abhishek Bachchan,Ajay Devgn,Rani Mukerji,161.0,Adventure Action Drama Crime,বাংলা हिन्दी,India,,,2004.0
mondo topless,Russ Meyer,Eve Productions,Babette Bardot,Pat Barrington,Sin Lenee,60.0,Documentary,English,United States of America,,,1966.0
the bridge,Eric Steel,Two 4 The Money Media EveryWhere Studios,Eric Geleynse,Susan Ginwalla,Caroline Pressley,93.0,Documentary,English,United States of America,,,2006.0
vixen!,Russ Meyer,Eve Productions Goldstein Films Coldstream Films,Erica Gavin,Garth Pillsbury,Harrison Page,70.0,Comedy Drama Romance,English,United States of America,76000.0,6000000.0,1968.0
empire falls,Fred Schepisi,Marc Platt Productions HBO Films Aspetuck Productions,Ed Harris,Philip Seymour Hoffman,Helen Hunt,197.0,Drama Romance,English,United States of America,,,2005.0
piccadilly,E.A. Dupont,British International Pictures (BIP),Anna May Wong,Gilda Gray,Jameson Thomas,92.0,Drama,English,United Kingdom,,,1929.0
the private life of henry viii,Alexander Korda,London Film Productions,Charles Laughton,Robert Donat,Franklin Dyall,97.0,Comedy Drama Romance History,English,United Kingdom,,,1933.0
apocalypto,Mel Gibson,Icon Productions Icon Entertainment International Touchstone Pictures,Rudy Youngblood,Raoul Max Trujillo,Gerardo Taracena,139.0,Action Adventure Drama Thriller,English,United States of America,40000000.0,120175290.0,2006.0
household saints,Nancy Savoca,Jones Entertainment Group Peter Newman Productions Clinica Estetico Fine Line Features,Tracey Ullman,Vincent D'Onofrio,Lili Taylor,124.0,Drama,English,United States of America,5000000.0,712000.0,1993.0
raintree county,Edward Dmytryk,Metro-Goldwyn-Mayer (MGM),Elizabeth Taylor,Montgomery Clift,Eva Marie Saint,168.0,Drama Romance,English,United States of America,5000000.0,9080000.0,1957.0
flyboys,Tony Bill,Ingenious Film Partners Electric Entertainment Skydance Productions Flyboys Films,James Franco,David Ellison,Jean Reno,140.0,Action Adventure Drama History Romance War,English Français,United Kingdom United States of America,60000000.0,17800000.0,2006.0
jackass number two,Jeff Tremaine,Paramount Pictures,Johnny Knoxville,Bam Margera,Steve-O,95.0,Action Comedy Documentary,English,United States of America,11000000.0,72778712.0,2006.0
all the king's men,Steven Zaillian,Columbia Pictures Corporation Rising Star Relativity Media Phoenix Pictures VIP 4 Medienfonds,Sean Penn,Jude Law,Kate Winslet,125.0,Drama Thriller,English,United States of America,55000000.0,9450897.0,2006.0
conversations with other women,Hans Canosa,Prophecy Pictures Ltd. Gordonstreet Pictures,Helena Bonham Carter,Aaron Eckhart,Yury Tsykun,84.0,Drama Romance,English,United Kingdom United States of America,450000.0,973525.0,2006.0
the land before time ii: the great valley adventure,Roy Allen Smith,Universal Cartoon Studios,Scott McAfee,Candace Hutson,Heather Hogan,73.0,Animation Family Adventure,English,United States of America,,,1994.0
father sergius,Alexandre Volkoff Yakov Protazanov,Yermoliev,Iwan Mosschuchin,Olga Kondorova,V. Dzheneyeva,112.0,History Drama,Pусский,Russia,,,1918.0
the assault,Fons Rademakers,Fons Rademakers Produktie,Derek de Lint,Marc van Uchelen,Monique van de Ven,124.0,History Drama,Nederlands Deutsch Pусский,Netherlands,,203781.0,1986.0
borat: cultural learnings of america for make benefit glorious nation of kazakhstan,Larry Charles,Twentieth Century Fox Film Corporation Four By Two Productions,Sacha Baron Cohen,Ken Davitian,Luenell,82.0,Comedy,English עִבְרִית қазақ,United States of America,18000000.0,261572744.0,2006.0
iraq for sale: the war profiteers,Robert Greenwald,unknown,Shereef Akeel,unknown,unknown,75.0,Documentary,English,unknown,,,2006.0
pan's labyrinth,Guillermo del Toro,Estudios Picasso Esperanto Filmoj Tequila Gang,Ivana Baquero,Maribel Verdú,Sergi López,118.0,Fantasy Drama War,Español,Spain United States of America Mexico,19000000.0,83258226.0,2006.0
the conqueror,Dick Powell,RKO Radio Pictures,John Wayne,Susan Hayward,Pedro Armendáriz,111.0,Action Adventure,English,United States of America,,,1956.0
the guardian,Andrew Davis,Contrafilm Firm Films Touchstone Pictures Beacon Pictures Eyetronics,Kevin Costner,Ashton Kutcher,Sela Ward,139.0,Action Adventure Drama,English,United States of America,70000000.0,55011732.0,2006.0
open season,Jill Culton Roger Allers Anthony Stacchi,Sony Pictures Animation,Martin Lawrence,Ashton Kutcher,Gary Sinise,83.0,Adventure Animation Family,English,United States of America,85000000.0,197309027.0,2006.0
school for scoundrels,Todd Phillips,Dimension Films,Billy Bob Thornton,Jon Heder,Jacinda Barrett,100.0,Comedy Drama Romance,English,United States of America,20000000.0,17807569.0,2006.0
romy and michele: in the beginning,Robin Schiff,Freeform Studios,Katherine Heigl,Alexandra Breckenridge,Kelly Brook,120.0,Comedy,English,United States of America,,,2005.0
st. martin's lane,Tim Whelan,Mayflower Pictures Corporation,Charles Laughton,Vivien Leigh,Rex Harrison,85.0,Comedy Drama,English,United Kingdom,,,1938.0
g.o.r.a.,Ömer Faruk Sorak,Böcek Yapım Besiktas Kültür Merkezi (BKM) Böcek Film,Cem Yılmaz,Rasim Öztekin,Özkan Uğur,127.0,Adventure Comedy Science Fiction,English Türkçe,Turkey,,,2004.0
the departed,Martin Scorsese,Vertigo Entertainment Media Asia Films Warner Bros. Initial Entertainment Group (IEG) Plan B Entertainment,Leonardo DiCaprio,Matt Damon,Jack Nicholson,151.0,Drama Thriller Crime,English 广州话 / 廣州話,Hong Kong United States of America,90000000.0,289847354.0,2006.0
the texas chainsaw massacre: the beginning,Jonathan Liebesman,New Line Cinema Next Entertainment Platinum Dunes Vortex/Henkel/Hooper Texas Chainsaw Productions,Jordana Brewster,Taylor Handley,Diora Baird,91.0,Horror,English,United States of America,16000000.0,107400000.0,2006.0
employee of the month,Greg Coolidge,Lionsgate,Dane Cook,Jessica Simpson,Dax Shepard,103.0,Comedy Romance,English Magyar,United States of America,12000000.0,38368909.0,2006.0
stormbreaker,Geoffrey Sax,"Isle of Man Film Weinstein Company, The Samuelson Productions",Alex Pettyfer,Sarah Bolger,Ewan McGregor,93.0,Adventure Action Family,English,Germany United Kingdom United States of America,40000000.0,23937870.0,2006.0
sirocco,Curtis Bernhardt,Columbia Pictures Santana Pictures Corporation,Humphrey Bogart,Märta Torén,Lee J. Cobb,98.0,Action Adventure Drama,العربية English,United States of America,,,1951.0
"hawaii, oslo",Erik Poppe,Paradox Spillefilm A/S,Trond Espen Seim,Jan Gunnar Røise,Evy Kasseth Røsten,125.0,Drama Foreign,Norsk,Denmark Norway Sweden,,,2004.0
dante's inferno,Harry Lachman,Fox Film Corporation,Spencer Tracy,Claire Trevor,Scotty Beckett,89.0,Drama,English,United States of America,,,1935.0
antibodies,Christian Alvart,Kinowelt Filmproduktion MedienKontor Movie GmbH,Wotan Wilke Möhring,André Hennicke,Heinz Hoenig,127.0,Thriller Crime Drama,Deutsch,Germany,1900000.0,,2005.0
dr. cyclops,Ernest B. Schoedsack,Paramount Pictures,Albert Dekker,Thomas Coley,Janice Logan,76.0,Adventure Horror Science Fiction,English,United States of America,,,1940.0
running with scissors,Ryan Murphy,TriStar Pictures,Annette Bening,Brian Cox,Joseph Cross,116.0,Drama Comedy,English,United States of America,12000000.0,6754898.0,2006.0
dillinger,Max Nosseck,King Brothers Productions,Edmund Lowe,Anne Jeffreys,Eduardo Ciannelli,70.0,Drama Action Thriller Crime,English,United States of America,1000000.0,2000000.0,1945.0
brute force,Jules Dassin,Mark Hellinger Productions Universal International Pictures (UI),Burt Lancaster,Hume Cronyn,Charles Bickford,98.0,Crime Drama,English,United States of America,,,1947.0
ellie parker,Scott Coffey,Strand Releasing,Naomi Watts,Scott Coffey,Jennifer Syme,95.0,Comedy Drama,English,United States of America,,,2005.0
the grudge 2,Takashi Shimizu,Columbia Pictures Corporation Ghost House Pictures Vertigo Entertainment,Sarah Michelle Gellar,Amber Tamblyn,Edison Chen,102.0,Horror Thriller,English 日本語 Pусский,United States of America,20000000.0,39143839.0,2006.0
man of the year,Barry Levinson,Universal Pictures Morgan Creek Productions,Robin Williams,Christopher Walken,Laura Linney,115.0,Comedy Drama Romance Thriller,English,United States of America,20000000.0,41237648.0,2006.0
the marine,John Bonito,Twentieth Century Fox Film Corporation Pacific Film and Television Commission WWE Studios,John Cena,Kelly Carlson,Robert Patrick,92.0,Action Adventure Drama Thriller,العربية English,United States of America,20000000.0,22165608.0,2006.0
infamous,Douglas McGrath,Killer Films Longfellow Pictures Warner Independent Pictures (WIP) Jack and Henry Productions Inc.,Sigourney Weaver,Toby Jones,Gwyneth Paltrow,110.0,Drama,English Deutsch,United States of America,13000000.0,1151330.0,2006.0
one night with the king,Michael O. Sajbel,Gener8Xion Entertainment,Tiffany Dupont,Peter O'Toole,Luke Goss,123.0,Drama,English,United States of America,20000000.0,13391174.0,2006.0
once in a lifetime: the extraordinary story of the new york cosmos,Paul Crowder John Dower,Passion Pictures Cactus Three ESPN Original Entertainment GreeneStreet Films BBC,Pelé,Franz Beckenbauer,Carlos Alberto,97.0,Documentary,English,United States of America United Kingdom,1000000.0,,2006.0
fellini's casanova,Federico Fellini,Produzioni Europee Associati (PEA) Fast Film,Donald Sutherland,Tina Aumont,Cicely Browne,155.0,Drama History Romance,Italiano,Italy United States of America,,,1976.0
the howards of virginia,Frank Lloyd,Columbia Pictures,Cary Grant,Martha Scott,Cedric Hardwicke,116.0,Drama History War,English,United States of America,,,1940.0
the last bolshevik,Chris Marker,Centre National de la Cinématographie Les Films de l'Astrophore,Aleksandr Medvedkin,Nikolai Izvolov,Léonor Graser,121.0,History Documentary Foreign,English Français Pусский,France,,,1993.0
chapayev,Sergei Vasilyev,Lenfilm Studio,Boris Babochkin,Leonid Kmit,Varvara Myasnikova,93.0,Comedy Drama History War,Pусский,Russia,,,1934.0
the elementary particles,Oskar Roehler,MOOVIE - the art of entertainment GmbH Medienfonds German Film Productions GmbH & Co. KG,Christian Ulmen,Moritz Bleibtreu,Martina Gedeck,105.0,Drama Romance,English Deutsch,Germany Ireland,6000000.0,,2006.0
jackpot,Pekka Karjalainen,Jackpot Films Oy,Heikki Silvennoinen,Timo Kahilainen,Heikki Vihinen,97.0,Comedy,suomi,Finland,,,2006.0
feast,John Gulager,Neo Art & Logic Dimension Films Maloof Motion Pictures,Balthazar Getty,Henry Rollins,Navi Rawat,95.0,Action Comedy Horror,English,United States of America,3200000.0,658573.0,2005.0
offside,Jafar Panahi,Jafar Panahi Film Productions,Sima Mobarak-Shahi,Shayesteh Irani,Ayda Sadeqi,93.0,Drama Comedy Foreign,فارسی,Iran,2500.0,,2006.0
offside,Jafar Panahi,Jafar Panahi Film Productions,Sima Mobarak-Shahi,Shayesteh Irani,Ayda Sadeqi,93.0,Drama Comedy Foreign,فارسی,Iran,2500.0,,2006.0
offside,Jafar Panahi,Jafar Panahi Film Productions,Sima Mobarak-Shahi,Shayesteh Irani,Ayda Sadeqi,93.0,Drama Comedy Foreign,فارسی,Iran,2500.0,,2006.0
offside,Jafar Panahi,Jafar Panahi Film Productions,Sima Mobarak-Shahi,Shayesteh Irani,Ayda Sadeqi,93.0,Drama Comedy Foreign,فارسی,Iran,2500.0,,2006.0
little children,Todd Field,New Line Cinema Standard Film Company Bona Fide Productions,Kate Winslet,Patrick Wilson,Jennifer Connelly,136.0,Romance Drama,English,United States of America,26000000.0,14821658.0,2006.0
deliver us from evil,Amy Berg,Disarming Films,Oliver O'Grady,Thomas P. Doyle,Pope Benedict XVI,101.0,Crime Documentary,English,United States of America,12000000.0,201275.0,2006.0
marie antoinette,W.S. Van Dyke,Metro-Goldwyn-Mayer (MGM),Norma Shearer,Tyrone Power,John Barrymore,149.0,Drama Romance,English Español,United States of America,40000000.0,60900000.0,1938.0
f.i.s.t.,Norman Jewison,United Artists chateau productions,Sylvester Stallone,Rod Steiger,Peter Boyle,145.0,Drama Action,English,United States of America,11.0,11.0,1978.0
facing the giants,Alex Kendrick,Destination Films,James Blackwell,Alex Kendrick,Shannen Fields,111.0,Drama,English,United States of America,100000.0,10178331.0,2006.0
broadway bill,Frank Capra,Columbia Pictures,Warner Baxter,Myrna Loy,Walter Connolly,104.0,Comedy Drama,English Français Español,United States of America,668900.0,1400000.0,1934.0
the last king of scotland,Kevin Macdonald,Fox Searchlight Pictures Cowboy Films DNA Films Scottish Screen UK Film Council Filmfour Slate Films Tatfilm,Forest Whitaker,James McAvoy,Simon McBurney,121.0,Drama,English Français Deutsch Kiswahili,United Kingdom Germany United States of America,6000000.0,48027970.0,2006.0
the u.s. vs. john lennon,David Leaf John Scheinfeld,Authorized Pictures,Stew Albert,Tariq Ali,Carl Bernstein,99.0,Documentary,English,United States of America,,,2006.0
shortbus,John Cameron Mitchell,Fortissimo Films Process Productions Q Television,Sook-Yin Lee,Paul Dawson,PJ DeBoy,101.0,Romance Drama Comedy,English,United States of America,2000000.0,5179037.0,2006.0
3 blind mice,Mathias Ledoux,unknown,Edward Furlong,Emilia Fox,Elsa Zylberstein,89.0,Crime Foreign Thriller,Español,United Kingdom,,,2003.0
children of men,Alfonso Cuarón,Universal Pictures Strike Entertainment Hit & Run Productions,Clive Owen,Michael Caine,Julianne Moore,109.0,Drama Action Thriller Science Fiction,English,United Kingdom United States of America,76000000.0,69959751.0,2006.0
the prestige,Christopher Nolan,Warner Bros. Touchstone Pictures Syncopy,Hugh Jackman,Christian Bale,Michael Caine,130.0,Drama Mystery Thriller,English,United States of America,40000000.0,109676311.0,2006.0
flags of our fathers,Clint Eastwood,DreamWorks SKG Amblin Entertainment Malpaso Productions Warner Bros.,Ryan Phillippe,Adam Beach,Jesse Bradford,132.0,War Drama History,English,United States of America,90000000.0,65900249.0,2006.0
flicka,Michael Mayer,Twentieth Century Fox Film Corporation Fox 2000 Pictures Zucker/Netter Productions,Tim McGraw,Maria Bello,Armie Hammer,95.0,Drama,English,United Kingdom United States of America,15000000.0,21000000.0,2006.0
sleeping dogs lie,Bobcat Goldthwait,HareBrained Pictures,Melinda Page Hamilton,Bryce Johnson,Geoff Pierson,87.0,Drama Comedy Romance,English,United States of America,,,2006.0
after five in the forest primeval,Hans-Christian Schmid,ARD,Franka Potente,Axel Milberg,Dagmar Manzel,99.0,Comedy Drama,Deutsch,Germany,,,1995.0
9th company,Fyodor Bondarchuk,Finnish Film Foundation Matila Röhr Productions (MRP) Yleisradio (YLE) Art Pictures Group Slovo Channel 1+1 Telekanal STS,Aleksey Chadov,Konstantin Kryukov,Ivan Kokorin,139.0,Drama History War Action,Pусский,Russia Ukraine Finland,9500000.0,24000000.0,2005.0
